Index,Newspaper,Date,Title,Text,Category,Page_number,Political_camp,Raw_article_length,Title_length,Month,Racial_label,Sentiment
263,Ming Pao Daily News,2019-05-03,背囊漢街頭遭劫4萬 途人助擒賊 起回失款檢牛肉刀 一南亞漢在逃,【明報專訊】一名身懷巨款離開找換店的本地男子，昨午在黃埔遭兩名南亞裔男子持刀行劫，搶走裝有400 萬元的背囊，混亂間事主被刀所傷，負傷與匪徒展開追逐，其間3 名熱心途人加入協助，追逐數百米後合力制服其中一名疑犯，起回所有現金。甫出找換店 兩南亞漢持刀搶背囊昨下午5 時許，一名53 歲蔡姓本地男子在黃埔德民街15 號地下一找換店，將人民幣兌成400萬港元，並將一疊疊現鈔放進一黑色背囊，然後離開找換店。男子在約200 米外的紅磡道與德安街交界被兩名持刀蒙面南亞裔賊人從後行劫，搶去背囊，糾纏間男子右手擦傷，左腿亦有刀傷。賊人得手後沿紅磡道向黃埔花園錦桃苑方向逃去。事主負刀傷窮追 3人聞「搶嘢」加入兩名賊人穿過錦桃苑後，途徑一間郵政局及必勝客薄餅店，事主負傷一直尾隨窮追兩名賊人，其間多次大叫「搶嘢」，3 名熱心市民包括兩名必勝客職員及一名休班警長聞言加入追捕。賊人沿船景街逃走，逃至黃埔天地美食坊對開，其中一名賊人被追逐數百米後，被途人合力制服，另一賊人逃去無蹤。據悉，協助捉賊的休班沙展為警察學院教官。其後警員趕至，將賊人拘捕帶署調查。賊人逃走時遺下兩個背囊，其中警方在事主的黑色背囊內起回所有失款，並在另一個屬於賊人的灰色背囊起獲一把長約45 厘米的牛肉刀及一頂帽，相信為犯案時所用。事主被送往伊利沙伯醫院治理，據悉他亦從事找換生意，現正留院觀察。涉嫌行劫被捕印度裔男子21 歲，來港3 年持「行街紙」，報稱無業。警方仍追緝一名在逃南亞裔疑犯，年約20 至30 歲，身高約1.7 米，壯身材，留有鬍鬚，犯案時頭戴鴨舌帽，身穿黑色及灰色長袖T 恤、深色長褲及藍色波鞋。九龍城警區總督察（刑事）呂思灝指出，賊人明顯有預謀犯案，但未見有黑社會成分，正從多方面調查。呂亦稱，警方十分感謝3 名途人見義勇為，熱心幫忙制服疑犯。案件現交九龍城警區重案組第2 隊跟進，警方呼籲任何人如有任何資料，可致電3661 7981 提供。####事主事主事後到伊利沙伯醫院接受治理，右手貼有紗布。起回失款警方在賊人遺下的兩個背囊，起回全部400萬失款及一把牛肉刀。 （樊銳昌攝）熱心途人兩名熱心協助追賊的必勝客員工（左三及左四），事後向警員講述經過。（樊銳昌攝）,港聞,A03,Neutral,922,31,5,1,1
264,Oriental Daily News,2019-05-03,南亞雙匪搶劫4萬,南亞兵團及假難民禍港連連，當街搶劫途人四百萬現金一人就擒。一名中年本地男子昨午攜大額人民幣，到紅磡黃埔一間找換店兌換四百萬港元現金後，揹着放有巨款的背囊離去，途中突遭兩名南亞匪從後截劫，事主拚死反抗，一匪徒揮刀斬傷事主左腳，另一匪徒搶去背囊後逃走，事主負傷追截大嗌「搶嘢」，有店舖職員及休班警協助追截，終把一名持行街紙的印度漢制服，另一人逃脫。警方在場檢獲兩個背囊、一把牛肉刀及起回所有失款，案件列作行劫，交由重案組跟進，不排除刀匪早已洞悉事主行蹤，正追緝在逃匪徒及追查有否幕後人操控。一名南亞漢被帶上警車。（互聯網圖片）案發於昨日下午五時許，五十三歲男事主攜着大額人民幣，到黃埔德民街一間找換店，將人民幣兌換成四百萬港元後，把巨款放入隨身的背囊後離去。當事主行至一百五十米外的德安街及紅磡道交界，突遭兩名南亞裔匪徒從後攔途截劫，事主反抗抱緊背囊，其中一名匪徒見狀即手起刀落，事主左腳中刀血流如注，另一匪徒則搶去其背囊，兩匪得手後拔足逃走。事主不甘損失，負傷尾隨追截，沿途高呼大叫「搶嘢呀！」期間更不慎跌倒擦傷右手。休班警及食肆職員制服疑犯現場消息指，兩刀匪沿紅磡道左轉入德豐街，期間德豐街一間食肆的兩名職員，以及附近一名休班警員得悉有罪案發生，即時加入協助追截。刀匪見後有追兵，隨即左轉出船景街企圖甩身，在跑至距離案發地點約五百米的德安街時，其中一名戴鴨舌帽的匪徒，被追及的休班警員及食肆職員合力制服，另一匪徒則棄下一個背囊，趁亂朝巴士總站的方向逃去。據悉，協助追截匪徒的休班警在警察學院擔任教官，為一名警長。警方接報後趕至，拘捕一名懷疑涉案、持行街紙留港三年的二十歲印度男子，把他押上警車帶署扣查，同時大批警員則手持盾牌，在現場及附近一帶搜捕另一刀匪。警方在現場發現兩個背囊，初步證實其中一個屬於匪徒，內裏有一把牛肉刀，另一個相信屬於事主，內有多疊現金鈔票，在點算後證實所有失款已經尋回。由找換店尾隨事主  伺機落手警方經初步調查後，把案件列作行劫，交由九龍城警區重案組跟進，不排除刀匪早已掌握事主行蹤，由找換店開始已尾隨事主再伺機落手，正循包括疑犯及男事主的背景作進一步調查，不排除案件背後涉及具組織性的犯罪集團，同時追緝該名年約二十至卅歲，留有鬍鬚，案發時戴鴨舌帽，身穿黑灰色長袖T恤，深色長褲及藍色波鞋的南亞匪歸案。至於受刀傷的事主則由救護車送院，經治理後情況穩定，有親友接到消息後趕至醫院了解。,港聞,A22,Pro-Beijing,1003,8,5,1,0
265,Sing Tao Daily,2019-05-03,兩刀匪劫鈔4萬 休班警勇擒南亞漢 商人被斬手腳 巨款失而復得,記者：徐裕民 黃文威紅磡發生四百萬元街頭巨劫案，休班警長英勇擒賊！一名中港商人，昨午在找換店，兌換四百萬元現金，離開時被兩名持「行街紙」印度男子揮刀截劫，斬傷其手腳，搶去全部現款逃走，被一名休班警長發現，追蹤三百米後，與兩名途人合力擒獲其中一疑匪，起回全部失款，其餘一匪逃去，事主巨款失而復得送院治理，警方正調查是否熟人策劃。兩匪當街斬人劫走四百萬元巨款，一匪被捕，另一逃脫。遇劫事主蔡X新（五十二歲），經營中港生意，昨午五時許，蔡獨自往紅磡民泰街近德民街一家找換店，以人民幣兌換四百萬元港幣現金後，放入一個黑色背囊離開。市民合力追捕蔡沿德民街橫過紅磡道，至黃埔花園時尚坊商場外，突有兩名南亞裔青年走近，其中一人從背囊，取出一柄半米長牛肉刀指嚇蔡，繼而強搶其手上的黑色背囊，事主不甘損失反抗，被賊人揮刀斬傷右手前臂及左小腿。兩匪趁機搶去事主盛有巨款的黑色背囊，沿德民街經船景街轉入德豐街奔逃，蔡負傷尾隨窮追，沿途高呼救助，當時不少途人目睹事件連忙報警，附近一家食肆兩名員工，與一名商場保安員，亦聽到事主呼救，並看見兩名賊人逃跑，見義勇為一起尾隨追逐。當時，一名隸屬警察學院的休班警長李錦超（五十歲），剛駕車經過德豐街，見兩名南亞男子沿馬路狂奔，更見其中一人將一柄利刀放回背囊。警長憑經驗相信兩人正在犯案，於是棄車徒步前往調查。但下車後即失去兩人影蹤，卻未有放棄，仍四處搜捕。據知，兩名賊人似乎對現場環境並不熟悉，沿德豐街奔跑時仍四處覓路逃走，其後更沿德豐街折回德安街，走至船景街交界黃埔天地美食坊對開時，休班警長追蹤而至，連忙上前表露身分，喝令兩人接受調查。一賊乘亂逃去兩人不合作並反抗，警長隨即出手制止，而剛巧追至的兩名食肆職員亦上前協助，合力將手持黑色背囊賊人按地制服，另一賊人則乘亂逃去。大批警員接報持盾牌趕至拘捕疑人，並在黑色背囊內起回全部贓款，亦在賊人所揹白色背囊內，檢出犯案牛肉刀。受傷事主則送伊利沙伯醫院治理，未有大礙。　　據九龍城警區總督察（刑事）呂思灝稱，被捕疑匪二十歲，印度籍，來港三年，持行街紙留港等候甄別。呂又稱，合力擒賊的三名人士十分勇敢。警方現正通緝一名在逃年約二十至三十歲賊人，他犯案時戴鴨舌帽，穿黑灰色上衣及藍色牛仔褲，相信他亦為持行街紙印度漢。警方並調查案件是否有熟悉事主行蹤人士涉案，由九龍城警區刑事調查隊跟進。####■遇劫事主被斬傷手腳送院治理。　黃文威攝■警方在賊人背囊內起出用來斬傷事主牛肉刀。■警方起回被賊人劫走盛有四百萬元背囊。徐裕民攝■被捕疑匪押上警車。網上圖片■警方展示起回四百萬元現鈔和疑匪犯案牛肉刀。徐裕民攝■大批警員在案發現場調查。,港聞,A07,Pro-Beijing,1095,30,5,1,1
266,Ta Kung Pao,2019-05-03,紅磡截劫男子4萬元 兩南亞刀匪一就擒一逃遁,【大公報訊】突發組報道：兩名持牛肉刀的南亞裔劫匪，昨於紅磡鬧市攔途截劫一名剛兌換港元的男子，強行搶走事主身上一個藏有400萬元現金的背囊，得手後逃走。事主高呼： 「搶嘢呀！」兩名見義勇為途人及一名休班警長尾隨追截，在約500米外合力制服一名刀匪，起回所有贓款，另一刀匪則逃遁。九龍城警區總督察呂思灝表示，被捕疑匪20歲，印度裔，持行街紙來港三年，警方正追緝一名年齡介乎20至30歲的南亞裔同黨。起回贓款事主輕傷案發於昨午5時許，該名53歲的男子，在附近一間找換店兌換了400萬港元，把它們藏於背囊，途經紅磡道及德安街交界的黃埔花園二期錦桃苑1座對開街頭時，被兩名手持18吋長牛肉刀的南亞裔匪徒截劫。事主反抗及高呼： 「搶嘢呀！」混亂期間手被割傷，跌倒地上。劫匪搶走藏有400萬元現金的背囊後逃走，兩名薄餅店職員及一名休班警長聞訊，加入追捕。他們在黃埔號美食坊對開，合力制服一名疑匪；另一名刀匪則扔下背囊逃走，不知所終。警員接報到場將該名疑犯拘捕，而大批警員手持盾牌在附近搜捕另一名刀匪，在地上檢獲兩個袋，一個是屬於事主的背囊，起回所有贓款，另一個相信屬於刀匪的，內藏一把牛肉刀。事主手腳擦傷及被割傷，由救護車送院治理，一名女親友趕到醫院探望。####事主到院包紮，手部受輕傷匪徒留下一把牛肉刀及內藏現金的背囊,港聞,A08,Pro-Beijing,554,21,5,1,1
267,Wen Wei Po,2019-05-03,當街斬人猖狂 南亞雙煞掠4萬 「薄餅店雙勇」衝出助警追捕一匪落網現金追回,"香港文匯報訊（記者蕭景源、鄧偉明）紅磡繼去年9 月發生600萬元街頭斬人搶劫案，昨午再發生「翻版」劫案。一名身懷400 萬元現金男子遭兩名刀匪在光天化日下攔途截劫斬傷，刀匪搶去現金逃走，幸得兩名熱心市民聯同休班警長合力追捕，成功擒獲其中一匪，及起回贓款。警方正追緝在逃同黨下落。遇劫男事主，53歲，抗匪時右手擦損及左小腿被斬傷，清醒送院經治理，未有大礙。被捕匪徒，20 歲，印度裔，報稱無業，持「行街紙」居港3年，涉嫌「行劫」罪名，通宵扣查。事主負傷呼救熱心市民仗義消息稱，昨午5 時許，當時事主獨自到紅磡德民街一間兌換店，以人民幣兌換約400 萬港元現金，並將款項藏在一個不起眼的背包內掩人耳目離去。當事主途經紅磡道與德安街交界時，突遭兩名刀匪撲上施襲，糾纏間事主不敵被斬傷及強搶去背包，兩名匪徒得手即足沿時尚坊私家路往黃埔花園2 期錦桃苑方向逃走。事主負傷尾隨追截及大叫：「搶嘢呀！」途人聞訊報警；但事主追截期間不慎失足跌倒地上，眼看將要目送匪徒逃之夭夭，幸現場附近一間薄餅店兩名職員見義勇為跑出追截匪徒，其間再有一名學堂教官休班警長加入追捕。當兩名匪徒逃至數百米外德安街7 號對開時被追上，其中手持事主背包的匪徒被當場制服拘捕，另一名同黨則乘亂逃去無蹤。警員趕至封鎖現場調查，因天氣欠佳有雨需要用帳篷作遮擋，警方初步在事主背包內起回全部款項，並在匪徒背包內檢出一把紗布包手柄的牛肉刀，被捕南亞匪被鎖上手銬押上警車載署扣查。劫案中，事主未有損失，因反抗時受輕傷，由救護車送院治理。九龍城警區總督察(刑事)呂思灝表示，警方感謝兩名協助擒匪熱心市民，案件現交由九龍城警區重案組第二隊跟進，將循多方面展開調查，包括事主身懷巨款消息外洩是換錢期間被匪徒察覺或涉及知情人士，並追緝一名年約20歲至30歲留有鬍鬚的南亞裔在逃疑匪，犯案時戴鴨嘴帽，身着黑色及灰色長袖T 恤、深色長褲及藍色波鞋；呼籲有資料提供人士致電3661 7981聯絡。梁美芬讚揚英勇行為經民聯立法會議員梁美芬接獲黃埔花園發生400 萬元現金傷人劫案後，隨即趕到現場了解情況，初步得知警方迅速拘捕一名疑犯及起回贓款，目前還有一名匪徒在逃。她獲悉案發時，有薄餅店員工英勇協助警方制服疑犯，更特別到薄餅店讚揚有關員工的英勇行為，為他們打打氣。近年街頭巨額劫案2018年9月21日早上紅磡兩名珠寶公司職員，押運共值逾600萬港元外幣及現金支票外出，途經鶴園東街近紅磡道遭三名刀匪斬傷，匪徒強搶款項乘接應私家車逃去；警方同日在大角咀尋回涉案賊車，惟已人去車空。2018年8月8日晚上三名找換店職員在尖沙咀中間道，準備將裝有1,000萬元現金的行李篋放上七人車時，遭三名匪徒用玻璃樽扑頭襲擊，搶去行李篋乘接應私家車逃去。警方經連日追查共拘捕十名疑犯，但贓款下落不明。2018年2月9日下午尖沙咀重慶大廈一間找換店的五名職員，押送兩篋共4.5億日圓鈔票（約3,200萬港元）外出時，在街頭遭八名匪徒圍毆搶款乘接應私家車逃去；警方經追截擒獲其中三匪及起回巨款。2018年1月18日晚上一名男子到北角英皇道一間快餐店附近與人洽購比特幣（Bitcoin）時，遭三名南亞匪箍頸襲擊，搶去藏有140 萬元現金的手提電腦袋逃去。整理：香港文匯報記者蕭景源警方拘捕其中一名疑犯帶上警車。網上圖片遇劫受傷男事主(左一)等候送院敷治。網上圖片梁美芬到案發現場了解情況。梁美芬fb圖片警方展示現金、牛肉刀及背包等證物。",香港新聞,A05,Pro-Beijing,1423,36,5,1,0
268,Hong Kong Commercial Daily,2019-05-04,大聯盟促請打擊假難民,日前紅磡黃埔花園發生巨款劫案，2 名南亞裔刀匪劫去本地男子400 萬元現金。守護黃埔安寧大聯盟及打擊假難民大聯盟召開記者會指，假難民日益嚴重，不但耗用大筆公帑，公營醫療等公共服務、法律援助開支大增，更造成治安問題。團體形容假難民的問題已令區內居民忍無可忍，促請政府修例徹底解決假難民問題。出席記者會的立法會議會梁美芬指出，香港應先盡量減低假難民來港誘因，例如限定法律援助時數，以將其申請時間上限設定為3 個月內，並下調現時每月3400 元的生活費。她又指，政府應該向律政司、司法機構增加資源處理積壓個案，徹底解決假難民問題，避免「將個波由行政機關射去司法機關」。政府亦應在源頭堵截，在假難民來源國加強宣傳酷刑聲請者不能在港工作，避免當地人民被誤導而偷渡來港。,香港新聞,A05,Pro-Beijing,329,10,5,1,0
269,Hong Kong Commercial Daily,2019-05-04,4萬元巨款劫案 警多拘1印度漢,【香港商報訊】記者馮仁樂報道：警方經深入追查後，昨日拘捕紅磡黃埔花園400 萬元巨款劫案另一名在逃疑犯歸案。警方指，不排除再有更多人被捕，現正調查兩名被捕男子的關係，以及事件是否涉及組織性。九龍城警區重案組探員經調查後，昨日下午在紅磡銀漢街一個劏房單位內，拘捕一名持行街紙的印度男子，懷疑他有份參與前日的搶劫案，探員並在單位內檢獲兩個口罩及兩部手機作調查。據悉，被捕男子持「行街紙」留港接近10年。案發前日傍晚5 時許，一名剛從紅磡德民街找換店換取400 萬港幣的本地男子，行經紅磡道時遇到2 名南亞裔持刀賊搶劫，幸好得熱心市民及休班警長合力追捕擒賊，被搶走的巨款最終失而復得，男事主手腳受傷送院治理，目前情況穩定。####涉400萬元劫案疑犯被捕。,香港新聞,A07,Pro-Beijing,325,15,5,1,1
270,Oriental Daily News,2019-05-04,殺入黃埔斬人搶劫 議員促加強堵截 政府拒設禁閉營 假難民禍港未停,香港假難民問題日趨惡化，前日在黃埔再次發生兩名南亞裔人士持刀行劫事件，劫走四百萬港元現金，揭示假難民嚴重威脅社會治安。有關注團體形容假難民「治安大毒瘤」已蔓延至全港，促請港府修例從源頭堵截假難民，包括建議當局修例不再向聲請者發放「行街紙」，同時重開禁閉營暫羈押聲請者一定時間以待核實身份，減少假難民來港「搵食」的誘因。有立法會議員認為，設禁閉營非不可行，訂明扣押聲請者約兩至三個月屬可接受範圍。大鴉洲重置大鴉洲難民營被視為有效阻嚇南亞居民湧港提難民聲請的做法之一。打擊假難民大聯盟及守護黃埔安寧大聯盟昨因應黃埔花園南亞匪劫案作案召開記者會。聯盟指出，現時假難民來港後可持「行街紙」自由出入，又可有限度打工，形容是「好食好住」；又指截至去年七月的一萬二千多宗酷刑聲請個案中，八成是有關人士犯事被拘捕後才提出，反映聲請程序被濫用為逃避法律責任的渠道。打擊假難民大聯盟及守護黃埔安寧大聯盟建議港府修例，從源頭堵截假難民。（陳嘉順攝）倡不再向聲請者發行街紙他們認為，港府要從源頭堵截假難民來港，首先應減低誘因，故敦促當局盡快修例，不再向聲請者發放「行街紙」。聯盟又指，現時法院積壓了大量聲請的司法覆核個案，影響司法工作之餘又耗用大量公帑，形容當局「將個波由行政機關射去司法機關」，認為急需要修例以堵截該漏洞。他們同時要求當局重置禁閉營，確保假難民不會影響社會治安，又可增加阻嚇力。聯盟指出，現行法例容許扣留聲請者一段合理時間，所以當局應在處理及審核個案時，先禁閉聲請者至其身份獲核實為止，聯盟代表們曾到過往設難民營的大鴉洲視察，並向港府提交建議書，惟當局未有正面回應是否接納建議。扣押兩至三個月核實身份立法會議員梁美芬認為，重置禁閉營非全無空間，若訂明扣押聲請者約兩至三個月屬可接受範圍，「睇番政府喺立法會回應，當難民人數大減、羈押時間可以大大縮短，咁（政府）可能就會考慮吓；至於叫做禁閉營抑或收容所，都只係名稱問題。」聯盟提到，黃埔花園原是寧靜和諧的社區，前日下午五時許的放學時段發生劫案，令區內家長非常憂慮；又認為劫案反映假難民問題非常嚴重，已蔓延至全港各區。打擊假難民大聯盟發言人、九龍城區議員林博就指，其實區內有不少少數族裔居民安分守己，惟假難民問題令街坊大為緊張，甚或「好人當賊辦」，造成歧視問題。他希望透過解決假難民問題，令區內少數族裔人士不再被誤解，又冀港府分別透過社會福利署及民政事務總署，協助他們學習中文及提供就業機會，促進社會共融，「假如南亞裔人士全部都安居樂業，咁相信佢哋就唔會誤入歧途，參與假難民集團胡作非為。」,港聞,A01,Pro-Beijing,1064,32,5,1,0
271,Oriental Daily News,2019-05-04,搶劫4萬案又拘印度假難民,【本報訊】紅磡黃埔前日發生南亞雙匪斬傷途人，掠去四百萬元的街頭行劫案，警方繼當日拘捕一名持行街紙的廿歲印度漢及起回全部失款後，九龍城警區重案組探員經翻查現場一帶的「天眼」錄影片段，以及經情報分析和深入調查後，迅速鎖定一名逃匪行蹤。至昨午探員採取行動，掩至土瓜灣銀漢街廿四號一劏房單位，拘捕一名持行街紙留港近十年的四十歲印度男子，初步相信他是劫案的其中一名匪徒。土瓜灣黃埔持刀行劫案，再有一名印度假難民落網。（郭垂垂攝）獨居劏房  持行街紙探員同時在劏房單位內，檢走懷疑與案有關的兩個口罩及兩部手機，帶返警署作進一步調查。警方表示，行動中並無遭遇反抗，相信該名四十歲疑犯獨居上址，正調查兩名疑犯之間的關係，不排除案件背後涉及具組織性的犯罪集團，正追查背後是否仍有其他涉案人士。治安惡化  街坊憂心劫案發生後，不少街坊均憂慮區內治安惡化，其中吳太憶述，女兒早年與友人坐在家維邨露天廣場聊天，把手機放在友人的背囊內，背囊則放在兩人腳邊，現場途人熙來攘往，一名南亞賊竟在眾目睽睽下搶去背囊逃去，直指：「大人都算啦，我個囡當時得十一歲，小朋友嚟啫！」她其後陪同女兒報案，惟賊人仍未落網。她續稱，近年區內愈來愈多南亞裔人士，不時聽聞他們會「搶嘢」，形容「佢哋要錢唔要命！」但政府未有正視問題，惟有自保提高警覺，並教女兒要提高警惕。此外，街坊陳小姐亦有感區內治安轉差，稱若要提款會找人陪伴以策安全。街坊簡女士則表示外出盡量不會攜帶貴重財物，入夜後見到南亞裔人士會「避之則吉」，她促請政府要正視假難民問題，防止有人濫用機制留港。,港聞,A01,Pro-Beijing,656,12,5,1,0
272,Oriental Daily News,2019-05-04,6年燒逾57億公帑 1.4萬假難民仍滯港,【本報訊】假難民禍港嘥公帑，港府一九/二○財政年度單是用於「繼續全面檢討處理免遣返聲請的策略」預計開支，就達到八億一千萬元，計及自一四/一五年度至今的六個財政年度，假難民六年間就耗費公帑足足五十七點五億元，其中照顧假難民衣食住行給予的人道援助開支佔最大比重。現時本港仍有接近一萬四千名假難民「賴死唔走」，部分人在港犯案纍纍。執法部門投入大量人力物力打擊假難民打黑工。倘聲請失敗 用法援上訴當局一八/一九財政年度預算處理聲請的開支約十三億九千九百萬元，已較一七/一八年度預算的十億六千六百萬元增逾三成，該筆開支包括審核聲請及處理有關上訴/呈請、公費法律支援及人道援助三個部分。在統一審核機制實施下，遭入境處拒絕的聲請中大部分會有向酷刑聲請上訴委員會提出上訴，上訴後仍可繼續司法挑戰港府。政府過去兩年因向免遣返聲請人提供法律支援，涉及的公帑開支高達四億二千三百萬元，數字驚人。保安局局長李家超早前指，將所有假難民拘留於收容中心，可阻止他們來港的誘因，因九成九假難民是來港打黑工，他又指，目前有三千宗免遣返聲請上訴個案，惟終審法院過去一年只處理約二百宗，目前入境處已加快處理審核工作有成效，截至去年底餘下五百四十宗個案待審核，預料可於今年第一季完成處理所有積壓申請。,港聞,A01,Pro-Beijing,530,20,5,0,0
273,Oriental Daily News,2019-05-04,假難民黑工拘不盡 兩孟漢各囚15月,【本報訊】再有假難民做黑工被判入獄，入境處今年三月十八日連同警務處進行「權能者行動」，在八鄉一個回收場內拘捕兩名孟加拉籍男子。兩人前日在沙田裁判法院被控在香港非法入境後或受遣送離境令或遞解離境令規限，未得入境處處長授權而留在香港接受僱傭工作，他們承認控罪，各被判監禁十五個月。入境處近年不時採取反非法勞工行動。持行街紙從事回收工作兩名涉案孟漢年齡分別為卅七及卅八歲，被捕時正在從事回收工作，在檢查身份證明文件期間，他們出示的均是不允許工作、俗稱「行街紙」的擔保書，及後的調查發現他們為免遣返聲請人士。入境處發言人警告，根據《入境條例》，非法入境者或受遣送離境令或遞解離境令規限的人不得接受有薪或無薪的僱傭工作，開辦或參與任何業務。違者一經定罪，最高可被判罰款五萬元及監禁三年。,港聞,A02,Pro-Beijing,338,17,5,1,0
