Index,Newspaper,Date,Title,Text,Category,Page_number,Political_camp,Raw_article_length,Title_length,Month,Racial_label,Sentiment
128,Ming Pao Daily News,2019-02-27,醜陋的政治共識,時常聽到坊間一些聲音，說香港的政治十分撕裂。在很多層面上這種說法看來都是對的；不過在多方面的撕裂中，香港政治光譜至少有一方面是有共識的。先說建制派。他們近年愈來愈偏向走上把大多屬南亞、非洲裔的尋求庇護者妖魔化的道路。他們不時會動不動就指控其為「假難民」，說他們是四處犯罪、製造不衛生、搶港人飯碗、用香港公共資源的寄生蟲。縱使這種說法罔顧有不少尋求庇護者是「真難民」，而那些不符合難民資格的，往往其實都是受盡欺凌、人口販賣勾當的受害者，但妖魔化尋求庇護者，能在政治上讓建制派在維護本土議題上搶回一點話語權。至於民主派，基於香港民運以前是建基於開放、進步思維，他們曾幾何時還懂得把批評不仁不義的獨裁政權，與把內地人整體地狠批分得開。不過近年有民主派背景的政客與公民社會人士，就以不同形式大打排斥來自內地者的旗鼓。無論是單程證議題或內地遊客湧港問題，他們都偏向不從政策角度討論問題，亦不把人數上把關無能，及不提供足夠公共資源處理各種「迫爆」問題的矛頭指向政府。反觀，他們都是煽情地用一些來自內地的新移民或遊客行為不檢的例子，或用一些不全面或誤導的所謂數據去「一竹篙打一船人」，靠製造仇恨來帶起有關議題。而令這情况更嚴重的，就是個別議題帶起者以專業人士身分自居，把妖魔化所有內地人的情緒在表面上合理化。說起專業人士，其實就算是一些傳統上相對地較多非華裔人士的行業，類似現象都有出現。近年，無論是自己所屬的法律界，或我認識個別朋友所屬的某些其他專業界別，每逢業界公會或協會有領導層選舉時，都有時會聽到一些企圖排斥非華裔參選人的聲音。各階層形成內向排外共識 我們應當反省從上述可見，近年香港各政治光譜、各階層所達到的共識，就是內向與排外。若只是個別派別或人士企圖挑起這種情緒，大家或許能說這只是少數人心胸狹窄，不代表香港整體；但當內向、排外情緒形成了一個廣泛共識時，我們就應當反省：為何我們整個光譜或階層都會有這些聲音？若內向、排外情緒不是有龐大的民意市場，又怎會被廣泛在公共討論空間上使用？看來這股情緒已成為香港社會主流。或許大家會認為，這又有何問題？首先，內向、排外情緒是一種病毒，今天能令大家對外來人無情，明天病毒就會令大家把這種無情套用在社會上被邊緣化的群體，後天就會令大家互相批鬥。第二，這股情緒與自由、開放思維背道而馳。放棄了這些進步思維，我們又如何談得上民主制度必需的包容？第三，內向與排外或許能令個別行為不檢的外來者消失，但亦會令外來人才，或至少願捱苦做一些香港「本地人」不願做的工作的勞動人口，都會消失。第四，老實說，撇除少數原籍廣東省寶安縣的人，大多數港人都是外來者或其後裔，憑何基礎去排外？總結來說，若香港真的想保持國際大都會地位，我們就需努力打破內向與排外的醜陋政治共識。否則，就算政權不繼續把香港的獨特色彩淡化，我們港人都足以令我城淪為中國一個南方小鎮。（作者按：以上是筆者個人意見，不代表他所屬的律師行或團體） 作者是執業律師,觀點,A22,Neutral,1221,7,2,1,2
129,Oriental Daily News,2019-02-28,6年57億白養假難民,假難民問題繼續狂燒公帑。港府二○一九／二○財政年度單是用於「繼續全面檢討處理免遣返聲請的策略」預計開支，就達到八億一千萬元，計及自一四／一五年度至今的六個財政年度，假難民六年間就耗費公帑起碼五十七點五億元。有立法會議員指假難民耗費公帑驚人，惟獲確立聲請少於百分之一，其他人都濫用，不少更在港作奸犯科，公帑使得「好唔抵」。有學者認為要以治本方法處理問題，包括退出《禁止酷刑公約》及設立禁閉式收容中心。假難民持續狂燒公帑。根據司法機構的開支預算，較高級別法院需處理數目激增的免遣返聲請案件，其中高等法院上訴法庭，去年處理民事上訴案有六百一十一宗，較一七年大幅增加逾倍，一九年預算亦有六百一十宗，升幅主要來自與聲請案件有關的上訴案件增加，由廿六宗增至三百九十三宗，即激增逾十四倍。需調動司法資源處理案件另外，高等法院原訟法庭民事流動案件表中，由預告審訊可進行至聆訊，一七年為十六天，但一八年大增逾倍至卅八天，平均輪候時間較三十天的目標時間長，原因亦是因有更多司法資源被調動至處理聲請相關案件。保安局開支預算中提到，下年度聲請的公費法律支援撥款有所減少，年度內會續全面檢討聲請策略及爭取立法會通過《入境（修訂）條例草案》；律政司開支預算就指，民事法律科將為處理按照統一審核機制提出的聲請而採取的立法措施及其他相關事宜提供法律意見。按入境處開支預計，一九年預算新免遣返聲請個案有一千二百個，過往經驗顯示，聲請數目受多項因素影響，如區內各國經濟情況及邊境走私活動等，大部分因素非入境處所能控制，但鑑於一六年起防止可能提聲請的人抵港實施的入境前管制措施已證實行之有效，故預計新聲請會與去年一樣，同處於較低水平。而今年預期接獲的上訴／呈請個案料會大減，由去年五千七百八十一個減至今年預期的一千九百八十個。議員促羈留曾犯事假難民資料顯示，過去數年假難民相關開支持續增加，一八／一九年度預算開支已增至十三點九九億元。理工大學專業及持續教育學院講師陳偉強批評，港府處理假難民治標不治本，以公費法律支援協助假難民，亦是對納稅人不公道，認為應退出《禁止酷刑公約》，及設禁閉式難民營令處理成本減低，指不少假難民耗用本港資源卻在港犯罪，令市民憤怒，政府如不徹底解決問題，市民會質疑政府軟弱無能。立法會議員葛珮帆指假難民數年間已「使咗我哋接近六十億」，數字驚人，計及人道支援等不同開支，相信下年度假難民問題所用公帑不止八億元，雖然尚待審核聲請已大減，但「全部去咗上訴同司法覆核」，現仍有逾一萬假難民滯港，公帑使得「好唔抵」，司法機構數字亦顯示假難民阻礙港人使用法庭服務，政府需多管齊下處理，盡快修訂入境條例，並羈留曾犯事、對港人生命財產有威脅的假難民。,港聞,A02,Pro-Beijing,1110,10,2,0,0
130,Apple Daily,2019-03-01,沙地姊妹申延期留港至第三國收容,【本報訊】化名Reem和Rawan的一對沙地阿拉伯姊妹，去年因不堪長期受虐而決定逃亡至澳洲，但途經香港時被截獲，滯留在港至今近半年，護照被註銷，昨日為逾期逗留期限最後一日。兩人的代表律師昨發聲明指，已向入境處申請延期居留，直到獲第三國家收容，入境處回覆已收到申請，有望申請會獲得批准。放棄信仰返沙地恐處死昨日是Reem和Rawan在港逾期逗留期限的最後一日，兩人代表律師韋智達（Michael Vidler）發表聲明指，基於人道立場，早前已向入境處申請延長兩姊妹在港逗留的期限，直到獲第三國家收容。韋智達在聲明中表示，入境處昨通知他們已收到延長逗留的申請，韋智達說有望申請能獲處方批准，而第三國家的簽證亦很快會獲批。聲明內容指出，由於兩姊妹已放棄了伊斯蘭信仰，此舉將會被沙地政府視為「叛教」，若回到沙地會被判處死刑。兩姊妹在聲明中表示，在港的每一天都活在恐懼中，希望能夠盡快覓到第三國家收容；二人亦感謝國際社會的關注及支持，希望國際社會能繼續給予支持，直到尋覓到一個安全的新家園。國際特赦組織香港分會昨亦發出聲明，認為港府絕不能遣返該兩姊妹，一旦遣返，兩人的生命將會受到威脅。國際特赦組織難民事務研究員凱特．舒茲（Kate Schuetze）表示：「香港政府有責任容許兩姊妹逗留香港，或讓她們前往可安全無虞並能尋求庇護的國家。若香港政府不履行其責任，二人的生命便會受到威脅。」入境處回覆《蘋果》指，不會評論個別個案或公開個別個案資料，又指會按照相關法律和政策有效地執行出入境管制工作。據了解，就沙地姐妹申請延期居留，入境處正考慮中，是否准許她們延期，她們聲稱受虐是考慮因素之一。■記者李雨夢,港聞,A08,Pro-democracy,695,15,3,0,2
131,Oriental Daily News,2019-03-01,強詞有理：食指浩繁 尾大不掉,如果說港府財政預算案有如一盤流水帳，那麼財政司司長顯然就是帳房先生，主要職責大概也就是算算收入和支出，然後循例派點糖敷衍民意，盈餘多的時候多派一點，盈利少的時候少派一點。本年度財政盈餘預料有五百八十七億元，不如上年度的一千四百多億元，派糖縮水乃意料中事，反正聊勝於無，帳房先生也變不出甚麼新花樣，製造不了甚麼新驚喜。最令人莫名其妙的是，上屆政府將財政儲備的部分投資收益設立房屋儲備金，今屆政府又將房屋儲備金回撥到財政儲備，等於左袋交右袋，右袋又交回左袋，這是甚麼意思？很明顯，當年曾俊華設立房屋儲備金，主要是為了營造盈餘減少的假象，降低市民派糖期望，而現在陳茂波推倒房屋儲備金，並分四年回撥到財政儲備，則是為了掩飾赤字預算。兩位帳房先生沒有別的本事，一味「玩財技」、「做假數」，實在無聊得很。為甚麼會有赤字預算？除了經濟放緩、收入減少等因素，港府大花筒也是主要原因之一，下年度經常性開支大增百分之九，還要應付大量基建工程，以及基建工程的超支，沒有赤字才怪。當然，偶爾的赤字預算並不是甚麼大事，反正財政儲備豐厚，完全可以應付，怕只怕港府毫無節制，尾大不掉，演變成結構性問題，這才是最大的隱憂。君不見，近年公務員編制愈來愈龐大，單是下年度就將增加三千四百多人，總數增至十九萬一千八百多人，當年好不容易「瘦身」，如今又日益「臃腫」，柴米油鹽，食指浩繁，負擔不可謂不沉重。說到大花筒，就不得不提假難民問題。過去六個財政年度，港府總共耗費五十七點五億元在假難民身上，不知何時才是了局。假難民中獲確立聲請的還不足百分之一，其他人都是濫用機制，這是眾所周知的事實，偏偏港府假仁假義，當斷不斷，果真是善財難捨，冤枉甘心！評論員陳競立,龍門陣,A32,Pro-Beijing,708,14,3,0,0
132,Oriental Daily News,2019-03-02,探射燈：南亞小販多區霸街 食署扮盲欺善怕惡,假難民霸街擺檔，食環署「發雞盲」掂行掂過！無牌小販猖獗，南亞幫見「無王管」也來分一杯羹。本報近日到多區視察，發現南亞「走鬼檔」版圖有擴大趨勢，每逢周末在中環、深水埗一帶傾巢而出，嚴重影響衞生及阻塞街道，惟當值食環署職員卻全程「扮盲」放生。有排檔商戶更稱曾被南亞幫「佔領」檔口，屢遭對方拋擲穢物騷擾，但求助無門惟有噤聲啞忍。關注團體斥食環署欺善怕惡，促加強執法以保障本地商戶。中環南亞小販在畢打街將貨物鋪滿一地，令本已擠擁的街道幾乎寸步難行。畫線淋糞佔地  逼走本地檔販「早排新年直頭霸我個位擺地攤，喺地下畫埋線，離晒譜！」近年在深水埗聚居的南亞裔人士增多，連帶南亞無牌小販的數量亦驟升，更不時因霸佔街道與排檔商戶發生摩擦。該區排檔商戶梁女士表示，數月前有行家與南亞幫爭執過後，排檔在半夜遭對方淋上糞便，她的檔位亦曾被南亞幫丟死老鼠作威嚇，惟由於言語不通，且區內南亞裔人士疑有黑幫勢力撐腰，故大部分商戶不敢與其對質。記者在假日實地巡查，發現逾半無牌小販均由南亞人主理，猶如「南亞特區」。南昌街有數名南亞裔「生意夥伴」以客貨車共同經營流動攤檔，在馬路旁將單車、背包、鞋、手推車、電器等二手貨物擺滿一地，不少途人走出馬路挑選心頭好，險象環生。福華街、大南街亦各有三檔南亞地攤，其中大南街有一名食環署制服人員駐守，惟僅離遠站立、插袋觀望，逾半小時仍未見其上前執法，阻嚇力形同虛設。同樣在深水埗開設排檔的陳先生指，區內排檔及地舖商戶經常因擺貨問題遭檢控，認為食環署持雙重標準。「我哋每年交租或者交牌費嘅，（食環署）就執得咁嚴，南亞佬就唔搞！」築建「南亞市集」假難民搶飯碗維港對岸的中環環球大廈商場外，是外傭假日安排寄件回鄉的基地，附近數條街道擠得水洩不通。食環署多年來就上述情況「隻眼開隻眼閉」，同時助長南亞無牌小販擺賣，甚至形成「南亞市集」，讓假難民得以從中營商獲利。視察所見，畢打街、遮打道、干諾道中一帶，以至鄰近和平紀念碑的行人隧道，一個上午便有近廿檔由南亞裔人士經營的無牌地攤，販賣各式衣物、首飾、手錶等，可謂應有盡有。南亞檔販將貨物鋪滿一地，引來大批外傭駐足揀貨，令本已擠擁的街道幾乎寸步難行，然而當日並非無執法人員。多名身穿制服的食環署職員，在環球大廈對出當值站崗，期間部分人曾到附近行人天橋巡邏，距離最近一檔地攤僅約十米，卻只顧與同僚有講有笑，未有作出檢控。獲食環署「放生」加上龐大外傭人流，一眾南亞無牌小販獲利甚豐，最旺時其中一檔半小時的生意額可達千元。根據《公眾衞生及市政條例》，除非領有食環署簽發的小販牌照，否則任何人均不得在街道上販賣，違例者最高可被判罰款一萬元及監禁六個月。此外，如無牌販賣活動同時引致阻塞通道，執法人員可引用《簡易程序治罪條例》加控違例人士在公眾地方造成阻礙，罪成可被判罰款五千元或監禁三個月。執法大細超  區議員憂治安惡化「執法不公，根本係欺善怕惡！」深水埗區議員、假難民關注組召集人李梓敬批評，食環署人員專挑容易應付的本地商戶下手，面對南亞裔犯罪分子卻視若無睹，有「大細超」之嫌。他續指，南亞幫非法擺賣會引來同鄉聚集，令販賣私煙、打架毆鬥、非禮強姦等罪惡活動更為頻繁，食環署有責任加強檢控以保障本地商戶和居民，避免令各區治安問題惡化。食環署發言人指，一八年檢控無牌小販的個案逾五千五百宗，無牌小販被定罪的個案則有近五千宗，兩項數字均比一六年大跌逾六成，涉及非華裔無牌小販的數字則沒有備存。發言人續稱，處理非法擺賣活動時均一視同仁，按現場實際情況和證據採取合適行動，無牌小販的國籍並非執法考慮因素。圖／文：專案組,港聞,A07,Pro-Beijing,1473,21,3,1,0
133,Oriental Daily News,2019-03-02,探射燈：無牌賣熟食收陀地 南亞黑勢力蔓延,南亞無牌小販四出「搵食」，騷擾本地排檔商戶及霸佔其檔口，惡行令人髮指。早前農曆新年，本報亦曾揭發旺角夜市冒現大量南亞無牌熟食小販，不僅製作過程衞生惡劣，存在食物安全問題，更被本地檔販怒斥「做爛市」影響收入，甚至有南亞幫佔據街道向本地小販「收陀地」。有關注團體憂慮，有關事件反映南亞裔人士已在本港建立一定勢力。旺角新春夜市冒現大批南亞無牌熟食檔販，部分更向本地小販「收陀地」。組織促盡快設禁閉營「已經超出單純影響環境衞生嘅層面，直頭係幫緊黑社會霸地盤。」「廿三萬監察」發言人王國興表示，假難民在港無收入，不少最終選擇投靠社團，然而造成如此局面，港府難辭其咎，「政府部門把關不力，又唔肯退出聯合國《禁止酷刑公約》，令大班南亞人滯留在港。」他促請港府將具案底的假難民遞解出境，並盡快設立禁閉營，以杜絕南亞黑勢力繼續蔓延。王國興,港聞,A07,Pro-Beijing,360,20,3,1,0
134,Oriental Daily News,2019-03-04,東方民調：陳茂波玩財技冚赤字 疑為填海鋪路,【本報訊】新一份財政預算案表面有盈餘，但實際上是一份「赤字預算」，上任不足兩年的特首林鄭月娥被指「使大咗」，政府經常性開支大增百分之九，導致本港未來四年中有三年現赤字，當局不惜推倒上屆政府設立的房屋儲備金，大玩財技將儲備金分四年回撥庫房，以增加收入冚赤字。有立法會議員質疑政府「做靚盤數」，是為「明日大嶼」填海計劃鋪路。港府處理假難民問題，狂燒公帑。前財政司司長曾俊華於二○一四年將財政儲備投資收益注資二百七十五億元成立房屋儲備金，翌年再向儲備金大幅「泵水」四百五十億元，以應付未來十年公營房屋供應目標，他一直被外界批評「玩財技」，減少盈餘，藉以減少市民對派糖的期望，故被批評為「守財奴」。而現任財政司司長陳茂波在預算案再「玩財技」，稱「房屋儲備金獨立於財政儲備之外，未能全面反映政府財政狀況」，以及「房委會至二○二三年每年仍有盈餘，短期內要動用房儲金的機會不高」，故建議將目前滾存至八百二十四億元的儲備金分四年回撥到財政儲備，而財政儲備會預留相同的數額以作公營房屋發展之用。應付假難民 又燒8.1億陳茂波又承認，預算案計及回撥金額後才會出現盈餘，故今次是「赤字預算」。若扣除房屋儲備金後則有三個年度現赤字，一九/二○年度因涉及派四千元及相當大力度的紓困措施等開支；至於二一/二二年度及二二/二三年度則要為多項基建工程「找數」。「派糖」愈縮愈少，除了應付基建項目開支大增外，政府仍要為假難民問題狂燒公帑，港府二○一九/二○財政年度單是用於「繼續全面檢討處理免遣返聲請的策略」預計開支，就達到八億一千萬元，計及自一四/一五年度至今的六個財政年度，政府就白花起碼五十七點五億元公帑。立法會議員尹兆堅批評政府「做假數」，質疑透過回撥房屋儲備金製造盈餘「做靚盤數」，是為「明日大嶼」填海計劃鋪路，若「明日大嶼」至少耗資幾千億甚至高達一萬億元，在財政赤字下仍要投資，風險很大，擔心政府強推「明日大嶼」將出現各種經濟及財政上的問題。此外，無論建制派或泛民主派均對財政預算案提出多項批評，炮轟關顧民生不足、無法令市民即時受惠，又認為緩急錯配，力度不足，亦有人批評輕視商界、中產需要等。,港聞,A08,Pro-Beijing,885,21,3,0,0
135,Oriental Daily News,2019-03-04,南亞幫又犯案 一藏毒一非禮,【本報訊】南亞兵團犯案不絕，兩漢分別涉藏毒及非禮被捕。前晚七時許，警員在港鐵屯門站進行反罪惡巡邏，見一名南亞裔男子眼神閃縮，形迹可疑，遂上前截查。詎料，該南亞漢迅速將褲袋內一個鋁袋丟進垃圾桶，並企圖逃走。警員奔前將他截停制服，再從垃圾桶內檢回鋁袋，揭發袋內藏有小量大麻，市值約三百元，遂以涉嫌藏毒將該名持香港身份證的尼泊爾裔男子（廿七歲）拘捕，帶署扣留調查，警方正進一步調查毒品來源。南亞兵團/假難民近年犯案事件簿摸23歲女 印度男被捕另外，昨凌晨四時許，一名廿三歲夜歸女子，獨自途經尖沙咀天文臺道時，一名南亞裔男子突從暗處撲出，向她上下其手，大肆非禮，女事主嚇至花容失色，拚命反抗，掙脫色狼，逃離現場，驚魂甫定後報警求助。警員接報趕至，向女事主了解案發經過及色狼衣着特徵後，在現場附近展開兜截，隨後截停一名形迹可疑的南亞裔男子。警方經初步調查後，懷疑他與案件有關，遂以涉嫌非禮，將該名持香港身份證的印度裔男子（廿六歲）拘捕，該男子被帶返警署扣查，案件交由油尖警區刑事調查隊跟進。,港聞,A12,Pro-Beijing,440,13,3,1,0
136,Oriental Daily News,2019-03-05,非禮夜歸女 南亞淫狼就擒,【本報訊】南亞色狼色膽包天，當街非禮夜歸女被捕。昨日凌晨一時許，一名四十五歲夜歸女子行經紅磡新碼頭街，一名南亞裔大漢突然從後撲出，企圖將她拖往暗處圖謀不軌，女事主拚命反抗高呼求救，糾纏間南亞漢續向事主上下其手大肆非禮，有途人聽聞呼救聲循聲查看，見狀慌忙協助報警。南亞兵團/假難民近年犯案事件簿警方接報趕至，在現場尋獲女事主，向她了解案發經過及色狼容貌和衣着特徵後，在附近一帶展開兜截追捕，未幾截停一名形迹可疑的南亞裔男子。警方經初步調查後，懷疑他與案件有關，遂以涉嫌非禮把該名四十二歲的南亞漢拘捕，帶返警署扣留調查，案件交由九龍城警區刑事調查隊跟進。,港聞,A14,Pro-Beijing,275,12,3,1,0
137,Oriental Daily News,2019-03-06,《阿王辣爆》轟預算案低糖 無助改善弱勢生活,【本報訊】財政司司長陳茂波上周發表新一份財政預算案，紓困措施大縮水。東方報業集團旗下《on.cc東網》時事評論節目《阿王辣爆》，主持人王國興形容預算案是「糖尿病餐」，大幅減糖令人失望，並批評當局擬動用二百億元在私人市場購買六十個單位作社福設施，擔心當中存在官商勾結。王又認為陳茂波未能做到「應使則使」，指政府過去五年耗費約五十億元公帑處理假難民問題，卻依然不去正視及解決。王國興狠批陳茂波未能應使則使，減派糖予基層卻縱容假難民浪費公帑。指推動過渡性房屋資金太少王國興指財政預算案「低糖低甜」，例如五類福利金受助人只有「雙糧」而非「三糧」，公屋租戶亦不獲免租，減稅及減差餉亦縮水，「好似灑胡椒粉咁周圍灑啲」，直指措施未能幫助弱勢社群作結構性改善生活情況。當局備受質疑的二百億元買物業作社福設施，王亦指有機會造成利益輸送和官商勾結，質疑為何用來推行過渡性房屋的就只有二十億元，強調土地問題更應加大力度處理。至於政府將八百二十四億元的房屋儲備金回撥庫房，王國興稱這只是財技，令未來幾年整體財政預算不會出現財赤，但他指出深圳地區生產總值已超越香港，批評港府未有利用龐大儲備去為香港投資，反而浪費大量金錢。假難民嘥公帑 未提相關建議王舉例指，假難民過去五年浪費約五十億元公帑，但政府卻拒絕退出聯合國《禁止酷刑公約》去堵塞漏洞，預算案亦沒有作出相關改善建議，令人失望。另外，王又批評陳茂波未有投資旅遊業 ，指郵輪碼頭存在的交通死症仍沒有解決方案，亦沒有新景點去吸引遊客。而用六億元翻新公廁及用兩億元設立城市林務發展基金鼓勵新人入行，正是早年政府「殺局」的後遺症。讀者欲觀看《阿王辣爆》全部內容，方法非常簡易。已安裝東網APP的讀者，只要登入東網APP，點選右上方的《東網電視》Icon，進入頁面後選擇左邊的「時事」分類，再點選各集節目，影片就會自動播放，更可一氣呵成觀看多集節目。另外，東網新推出的雙聲道功能已支援各款Android及iPhone手機，用法簡便。觀眾收看影片時會預設成以廣東話播放，只要一按螢幕下角「喇叭」按鈕，就可以揀選以普通話配音收看節目，滿足不同觀眾口味。網址:tv.on.cc,港聞,A19,Pro-Beijing,894,21,3,0,0
