Index,Newspaper,Date,Title,Text,Category,Page_number,Political_camp,Raw_article_length,Title_length,Month,Racial_label,Sentiment
402,Oriental Daily News,2019-07-18,再有南亞兵搶灘 22日第5宗三家村拘5人蛇,修訂《逃犯條例》草案引發社會動盪，示威衝突不絕致施政幾近癱瘓，政府變成跛腳鴨下，有包攬偷運人蛇勾當的黑幫趁亂在南亞多國造謠，慫恿人蛇在港府打擊假難民「辣招」出台前湧港「搵食」。繼前日警方在西貢截獲六名南亞及非洲人蛇後，在不足廿四小時內，昨早在西貢橫洲水域發現一艘載有偷渡客的「大飛」，水警包抄追截，在油塘三家村截獲快艇，駕船的蛇頭跳海逃遁，五名印度及巴基斯坦人蛇被捕，案件交重案組跟進，初步相信人蛇經內地作「跳板」偷渡來港。這是過去廿二日內，警方搗破的第五宗南亞偷渡案，共拘捕廿九名人蛇。南亞人蛇被押走扣查。（曾志恒攝）昨晨約八時，水警在橫洲對開約七海里海面，發現一艘載有數名南亞漢的大馬力快艇高速飛馳，由於近期截獲多宗南亞人蛇偷渡案，水警懷疑快艇上載有偷渡客，遂要求駕駛快艇的男子停航受查。惟舵手未有理會，相反快艇加速逃走，水警隨即加派多艘快艇包抄追截。未幾，可疑快艇駛入油塘三家村避風塘，水警快艇尾隨追至，作為蛇頭的男舵手見狀，即時棄船跳入海中，瞬間失去蹤影。遇查逃至三家村 蛇頭跳船遁水警在可疑快艇上，截獲四名印度男子（廿一至卅八歲）及一名廿七歲巴基斯坦男子，經調查後證實他們沒有香港身份證及入境紀錄，遂以涉嫌非法入境把他們拘捕，載返水警基地作進一步調查。同時，警方召來消防及政府飛行服務隊直升機，在場展開海陸空搜索跳海「潛逃」的蛇頭，除在沿岸及登上避風塘內的船隻搜查，消防蛙人亦在離岸約廿米處搜索，惜暫無發現。據悉，每名人蛇繳付五萬元「水腳費」後，入境中國作「跳板」在南方沿岸城市會合再循水路闖港，警方初步調查後，正追緝一名相信為蛇頭的中國籍男子，同時追查偷渡集團的幕後主腦，案件交由水警總區重案組跟進。趁亂來港「搵食」  至今拘29人據了解，偷運南亞人蛇向來由黑幫包攬，近期人蛇密集搶灘主因，是本港修訂《逃犯條例》草案風波引發社會動盪，黑幫「兵頭」覷準機會在南亞多國散布謠言，慫恿南亞人在港府出「辣招」修訂《入境條例》前，甚至趁警方近日疲於奔命時乘虛而入趕來香港「搵食」伺機犯案。計及本案，警方在過去廿二日內，已搗破五宗南亞偷渡案，共拘捕二十九名人蛇。上月廿六日，八名巴裔人蛇及兩名內地「蛇頭」在流浮山被水警拘捕；本月四日，七名巴裔人蛇在西貢西灣村搶灘被截。上周五，警員在西貢清水灣二灘截獲三名南亞裔人蛇。至前日早上十時許，警方在西貢截獲六名孟加拉及岡比亞人蛇。,港聞,A18,Pro-Beijing,986,21,7,1,0
403,Oriental Daily News,2019-07-18,筆下風雲：趁病攞命 內外夾擊,近期的暴力衝擊愈來愈血腥，已有多名警員重傷，社會撕裂程度比佔中時期有過之而無不及。然而，反對派仍不心足，繼續號召大型示威遊行，昨日有所謂的銀髮族遊行，星期日民陣又發起大集會，擺明不鬥死警察、不打垮港府不罷休。社會立立亂，牛鬼蛇神必然乘勢發難。果不其然，本地黑幫趁你病，攞你命，在南亞多國大肆散播「尾班車」言論，利用立法會暫時停擺之機，煽動當地南亞人盡快湧往香港舉手做假難民，否則日後落閘就難以來港云云。結果，沉寂多時的南亞人蛇偷渡活動近期死灰復燃，警方最少破獲四宗偷渡案。單是昨日，水警就在港島東水域查獲可疑舢舨，拘捕五名南亞兵，有人更趁亂逃遁。這些人都是經黑幫點兵一條龍來港，無非為了食大茶飯，充當黑幫生力軍。可憐香港人既被反對派搞到無日安寧，復要面對南亞兵團攞命威脅，內外夾擊，嗚呼哀哉。至於漢奸黎更是唯恐天下不亂。繼早前覲見美國副總統彭斯和國務卿蓬佩奧，得意忘形之下說漏了嘴，聲稱「香港為美國而戰」，將反修例風暴同美國直接連上、將香港人綁上美國戰車後，爛果報繼續火力全開，妖言惑眾，在頭版大字標題指港府研究在各區實施戒嚴，消息又在網絡炸開了鍋，網民信以為真，紛紛聲言以死相搏。即使保安局迅速否認亦無人理會，足證爛果報製造假新聞的威力驚人。面對反對派奪權圖謀，步步進逼，港府只能被動捱打，如果真有實施戒嚴的勇氣，早就不會落得如此折墮下場。有人趁火打劫，有人火中取栗，這固然反映黑幫和反對派居心叵測，即使港府已被打得奄奄一息，仍嫌未死得，出盡全力踩多幾腳，但更可悲的是香港陷入政治狂熱，內憂外患之下，人們渾然不知大禍將至，寧願盲信反對派，一味沉迷窩裏鬥，連法治之區和安全城市都親手葬送。傳媒人程萬里,龍門陣,A28,Pro-Beijing,700,14,7,1,0
404,Oriental Daily News,2019-07-18,雪地鴻爪：假難民假請願真作惡,香港社會百病叢生，其中一個大毒瘤就是假難民，政府五年間用了逾五十三億元公帑去處理。各界一直批評，為何用本地納稅人的血汗金錢去支援補助為非作歹的假難民，變相鼓勵更多人千方百計從其他地區偷渡來香港，成為他們的「搵食天堂」，或者用「犯罪天堂」來形容更貼切。南亞人蛇搶灘來港禁之不絕，本月份已破獲四宗，在上月尾更發現偷渡船上藏有槍枝，懷疑用作「食大茶飯」。這些「南亞兵團」被捕後便「舉手」申請酷刑聲請，做其假難民以拖延留港。今年首半年在港提出的新免遣返聲請個案超過五百七十宗。大部分聲請被入境處拒絕的人，會向酷刑聲請上訴委員會提出上訴，上訴失敗仍可藉司法覆核拖延留港，導致現時仍有逾萬名假難民滯港。假難民在港成為罪惡生力軍，無視法紀，給黑幫招攬作打手、僱傭兵。他們畫地為其後花園，在公眾地方如天橋底搭建木板屋，開闢「南亞新村」。政府一直拖延清拆，令「南亞新村」四周擴散，遍地開花。政府縱容以致遍地開花的，還有近日示威暴潮。你退一步，敵人進一步，示威者得寸進尺、變本加厲，現在十八區紛紛淪陷，即將來臨的星期日他們會再繼續搞大遊行，到時金鐘一帶又會成為戰場。現在香港可算是四面楚歌、十面埋伏，各種社會問題同時爆發，惡性腫瘤齊齊發作，特區管治班子尸位素餐，根本沒有能力去處理。修逃犯例已告一段落，現在示威根本師出無名，是以請願來包裝搶奪管治權的戰爭。港府把政治問題卸責警方處理，警隊顧此失彼，治安出現漏洞，給予南亞兵團等不法分子乘虛而入。現在已有迹象顯示毒禍惡化，就算能破案拉犯，監倉都坐滿了示威者。看來政府很有遠見，「明日大嶼」正好安置成千上萬的假難民、假請願真暴徒。評論員香桐仁,龍門陣,A28,Pro-Beijing,684,14,7,1,0
405,Sing Tao Daily,2019-07-18,「蛇船」闖西貢海域 水警截南亞五人蛇 追至三家村 蛇頭棄船逃遁,偷渡集團疑散播謠言，指本港容易取得難民申請資格，趁天氣穩定，安排偷渡團闖港，水警昨晨在西貢水域，發現一艘偷運人蛇的機動舢舨，展開追截，舢舨逃至油塘三家村避風塘，蛇頭棄船跳海逃走，水警拘捕五名南亞裔人蛇，再聯同直升機，展開海空搜索蛇頭但無果。記者：歐陽偉光 梁國峰水警在油塘擒獲五名南亞人蛇，一名蛇頭跳海逃去。昨晨八時許，水警在西貢橫洲對開約七海里水域，發現一艘可疑機動舢舨，看似準備在附近靠岸，於是以快艇追截，對方即加速逃走，雙方展開海上追逐，機動舢舨逃至油塘三家村避風塘，一名華裔蛇頭男子棄船跳海逃走，船上五名人蛇走到旁邊遊艇匿藏。人蛇由內地來港警員登上遊艇搜索，擒獲五名南亞裔人蛇，年齡由二十一至三十八歲，連同機動舢舨押返水警基地調查，他們報稱早前到達內地，由蛇頭安排乘坐機動舢舨偷渡來港。蛇頭跳海後一直未見浮回水面，警方隨即知會消防處蛙人協助，在距離岸邊二十米外各船底分階段搜尋，政府飛行服務隊直升機亦在上空盤旋協助搜尋，兩句鐘後仍無發現，收隊離去。來港以為易申難民有消息稱，人蛇集團近期疑不斷在南亞諸國散播謠言，指稱抵達本港可容易取得難民申請資格，逗留期間更可暗中打工，慫恿偷渡客來港搵食，導致大量南亞人蛇偷渡來港，昔日他們多會選擇在新界一帶岸邊登陸。連同昨天的一宗，警方在過去三星期，先後破獲五宗南亞裔人蛇偷渡案，拘捕近三十名人蛇，其中在前日早上有六名孟加拉及岡比亞偷渡客，在西貢搶灘後，擬乘的士前往市區被揭發，連同駕駛接應車輛的巴基斯坦裔司機被捕。警方相信近日天氣良好，將有更多非法入境者來港，故加強巡查。####■直升機協助搜索跳海逃走的蛇頭。歐陽偉光攝■水警拘捕五名南亞裔人蛇。,港聞,A12,Pro-Beijing,697,31,7,1,0
406,Wen Wei Po,2019-07-18,蛇艇闖鯉魚門警拘5南亞人蛇「蛇頭」跳海逃過海陸空搜捕不足一個月第五宗非華裔偷渡案,香港文匯報訊（記者蕭景源、鄧偉明）近期南亞人蛇偷渡來港愈來愈猖獗， 甚至直闖東九龍市區。繼前日有6 名南亞偷渡客在西貢搶灘，昨晨蛇艇竟直闖鯉魚門水域，在水警小艇高速追截下，蛇艇駛入三家村避風塘，「蛇頭」跳海逃遁，艇上5 名南亞偷渡客被捕，警方和消防海陸空搜捕失蹤的蛇頭，未有進一步發現。這是不足一個月內第五宗南亞人偷渡案，警方共截獲29名人蛇。昨晨被捕的5名南亞偷渡客(21歲至38 歲)， 4 人為印度籍，1 人為巴基斯坦籍，非華裔男子涉嫌「非法入境」罪名被扣查。昨晨8 時許，水警在香港東面水域巡邏期間，發現一艘可疑快艇正駛往鯉魚門方向，艇上有數名非華裔者，懷疑是蛇艇，水警派小艇尾隨追截，蛇艇逃至三家村避風塘，一名華裔「蛇頭」棄船跳海逃走，稍後水警截停蛇艇調查，證實船上5 名非華裔男子非法入境，遂將人蛇及快艇帶返西灣河水警基地扣查。另一方面，水警及消防員在現場一帶尋找跳海逃走失蹤的「蛇頭」，水警船在海面巡查及登上避風塘遊艇搜查，消防則派出蛙人在近岸位置潛入海中打撈，其間政府飛行服務隊亦派出直升機協助高空搜索，至昨晚深夜仍未有結果。警至今截獲29非華裔人蛇根據資料，上月26日至昨日為止，警方共截獲五批共29名非華裔人蛇，其中大部分來自巴基斯坦、孟加拉、印度等南亞國家，當中只有一宗是在流浮山截獲，其餘均是在香港以東及東北水域發現，相信自今年6 月底以來，偷渡集團安排人蛇多經由大鵬灣坐快艇來港，並在西貢搶灘。據悉，南亞人蛇先飛往內地，再經內地作「跳板」偷渡來港，然後提出免遣返聲請，以便持「行街紙」留港，令特區政府近年消耗大量資源，一方面與內地執法部門聯手堵截，另一方面本港準備修訂《入境條例》增加執法能力，不排除有人蛇集團在散播謠言，趕在修例前偷渡來港。■水警登船搜捕。大批水警快艇進入三家村避風塘追截偷渡者。■水警登船搜捕。?蛇頭跳海逃跑，消防員在岸邊戒備。,香港新聞,A10,Pro-Beijing,787,40,7,1,0
407,Sing Tao Daily,2019-07-19,黑工斷腳慘劇響警號,內地青年來港當「黑工」，不幸發生工業意外斷腳留醫，年邁父母來港看望，不禁悲從中來，事件令人難過，亦反映非法勞工問題嚴重。在本港當黑工的人，主要來自內地及東南亞，近年本港有大批南亞「假難民」湧現，他們濫用酷刑聲請機制，申領「行街紙」留港打工，亦有內地人士違反逗留條件當黑工，不法集團覷準黑工市場需求，收取中介費替他們安排工作，不少黑工以為可賺大錢，甘願先支付高昂中介費離鄉別井，抵港後卻被剝削，遇到意外隨時得不償失，亦求助無門。今次黑工斷腳事故，再次敲響黑工問題警號，有關當局宜考慮加重罰則，從源頭打擊違規中介人和違法僱主，並增加人手加密搜查經常有黑工的建築地盤及回收場等工地，同時加強宣傳「反非法勞工」訊息，讓有意當黑工的人知道當黑工會被重罰，並鼓勵市民舉報，以收阻嚇之效。,港聞,A04,Pro-Beijing,337,9,7,1,0
408,Oriental Daily News,2019-07-20,雷霆19：掃毒冚賭 拘南亞漢及港女,【本報訊】粵港澳「雷霆19」聯合反罪惡行動持續進行，其中本港警方於前日在深水埗區掃毒冚賭，拘捕三名南亞漢及一名本地女子。深水埗警區特別職務隊人員，早前接獲線報，指有不法分子在區內分銷毒品，經情報分析及深入調查後，警員於前日下午約五時進行反毒品行動，掩至醫局街一百卅七號深水埗公立醫局對開埋伏。期間，一名形迹可疑的女子出現，警員隨即上前把她截停搜查，結果在其身上檢獲約五點一克海洛英，市值約四千七百元。警方經初步調查後，同時揭發該名姓黃（四十歲）本地女子沒有攜帶身份證，她涉嫌「販毒」及「外出時沒有攜帶身份證明文件」被捕，已被帶返警署通宵扣查。其中兩名被捕南亞漢。深水埗賭檔檢釣魚機同晚約七時四十五分，深水埗警區特別職務隊人員，根據線報突擊搜查長沙灣道二百廿七號至二百廿九號一個單位，搗破一個非法釣魚機賭檔，當場檢獲三部釣魚機、一批遊戲卡及約一千二百八十元賭款。行動中，單位內一名巴基斯坦籍男子（卅一歲）疑為主持人，涉嫌「管理賭博場所」被捕；其餘兩名分別廿八及廿九歲的印度籍男子俱為賭客，涉嫌「在賭博場所內賭博」被捕，三人已被扣留調查。警方初步調查顯示，相信該賭檔已運作約一個月，正進一步追查該賭檔背後有否黑幫操控。南亞兵團/假難民近年犯案事件簿,港聞,A16,Pro-Beijing,522,17,7,1,0
409,Apple Daily,2019-07-21,雕像藏大麻兩毒販被拘捕,【本報訊】海關破獲一宗空運郵包藏大麻案，在一個雕像內撿獲市值73.5萬元的大麻，並拘捕兩名外籍毒販。市值73.5萬元涉販毒被捕的兩外籍毒販均年約36歲，據知兩人來自非洲，均持「行街紙」留港，報稱無業。本月16日，海關郵件清關組人員在機場檢查一件由南非空運來港的郵包時，在報稱雕像的郵包內發現藏有約3公斤的大麻，市值73.5萬元。其後案件交海關毒品調查科跟進，經調查後，前日下午5時在油麻地彌敦道一帶埋伏，拘捕兩名疑犯，並押他們返回油麻地住處搜查。海關人員表示，將與香港郵政及物流業界加強合作，並加強堵截利用郵寄快遞的渠道偷運毒品。海關強調販運危險藥物屬嚴重罪行，一經定罪，最高可被罰款5百萬元及終身監禁。■記者李家傑,港聞,A10,Pro-democracy,308,11,7,1,1
410,Oriental Daily News,2019-07-21,海關又破毒郵包 拘兩收件假難民,香港海關破雕像毒郵包，拘捕兩名非洲聲請漢。一件由南非空運抵港的牛頭雕像郵包，上周二被機場海關人員檢查揭發內有乾坤，雕像內部被掏空，暗藏一包重三公斤的懷疑大麻，總值逾七十三萬元，海關毒品調查科接手追查，前午採取行動，到油麻地收件地址，拘捕兩名收件人的非洲裔男子，他們均以酷刑聲請獲發行街紙留港，不排除被販毒集團招攬「收貨」運毒，海關將進一步追查。兩名疑犯被帶走扣查。（葉嘉文攝）海關郵件清關組人員，上周二在赤鱲角香港國際機場貨運站，例行檢查寄赴本港的郵包，期間發現一件由南非寄出、報稱為雕像的郵包，在X光機透視下，內裏物件影像異常，遂開啟郵包仔細檢查，揭發郵包內的一個牛頭雕像內部被掏空，並藏有一包共重約三公斤的懷疑大麻，總值約七十三萬五千元，案件隨即轉交海關毒品調查科接手追查。疑被毒販招攬運送調查人員根據「毒郵包」收件地點，到油麻地一處地點埋伏監視，至前午五時許，兩名非洲裔男子前來收郵件，於是以涉嫌販運危險藥物拘捕他們，再押返油麻地文英樓後座一單位搜查，惟無其他發現。被捕兩男均卅六歲，分別來自南非及岡比亞，同樣以酷刑聲請獲發行街紙暫准留港，不排除有販毒集團招攬留港「假難民」作為收件人收取及運送毒品。販毒集團常用郵包運毒，包括有利用食品、衣物、玩具及機械零件等掩人耳目，藏於郵包寄港，最終仍難逃海關「法眼」，屢被破獲，過去案件中被捕的收件人疑犯，不乏南亞及非洲裔聲請漢。最近一宗「毒郵包」案，於上月二十日被破獲，海關截查一件從馬來西亞寄港郵包，檢獲值五十四萬元懷疑K仔毒品，一名收取郵包的廿四歲男子在收件時被捕。另於去年十一月一日，海關在一件從阿根廷寄港郵包內，檢獲總值四百八十萬元懷疑可卡因毒品，並拘捕兩名負責收件，俱持「行街紙」的非洲莫桑比克及尼日利亞男子。加強堵截郵遞毒品海關重申，將會與香港郵政及物流業界保持緊密聯繫，加強堵截利用郵遞或速遞渠道偷運毒品。根據《危險藥物條例》，販運危險藥物屬嚴重罪行，一經定罪，最高可以被判罰款五百萬元及終身監禁。,港聞,A22,Pro-Beijing,830,15,7,1,0
411,Sing Tao Daily,2019-07-21,南非木牛藏毒寄港 兩假難民領件被捕,販毒集團招攬留港假難民運毒，機場關員日前檢查一件由南非寄港的郵包，揭發暗藏值逾七十三萬元懷疑大麻毒品，至前午兩名持「行街紙」留港的假難民到油麻地領取毒郵包時，當場被關員拘捕。檢獲大麻市值逾73萬海關郵件清關組人員，上周二在赤鱲角機場檢查一件由南非空運抵港、報稱是雕像的郵包時，發現內裏一隻木製牛雕像暗藏約重三公斤、市值約七十三萬五千元的懷疑大麻毒品。海關毒品調查科接手跟進，至前午約五時掩至油麻地彌敦道埋伏，趁兩名男子領取郵包時將他們拘捕，其後再押返文苑街一單位搜查，但無發現。被捕兩名男子分別來自南非及西非岡比亞，均三十六歲，俱持「行街紙」留港及報稱無業，將被通宵扣查。不法集團招假難民犯案海關表示，將與香港郵政及物流業界加強合作，加強堵截利用郵寄速遞渠道偷運毒品。海關強調販運危險藥物屬嚴重罪行，一經定罪，最高罰款五百萬元及終身監禁。人蛇集團近期疑不斷在南亞地區散播謠言，訛稱來港容易取得難民申請資格，逗留期間更可打工，慫恿偷渡客來港搵食，導致大量南亞「人蛇」偷渡來港，惟不少人來港申領「行街紙」後，因沒有工作，容易被不法集團招攬犯案，令本港治安亮起紅燈。另外，機場關員前日亦在香港國際機場檢查一批由加拿大到港的空運貨物，發現約十公斤懷疑大麻花混雜在盒裝車厘子中，該批毒品估值約一百七十萬元，關員其後拘捕一名三十八歲懷疑涉案男子。記者 蔡楚輝####關員展示藏毒的木製牛雕像。兩名涉案假難民被關員押走。蔡楚輝攝,港聞,A07,Pro-Beijing,607,17,7,1,0
412,Oriental Daily News,2019-07-22,東方民調：趁火打劫 南亞人蛇湧入 加速香港淪亡,修訂《逃犯條例》草案引發社會動盪示威不絕，行政、立法、司法及執法部門幾近癱瘓，有操控偷運人蛇的黑幫趁亂在南亞多國散布謠言，慫恿人蛇在當局打擊假難民「辣招」出台前湧港「搵食」，導致大量南亞人蛇蜂擁而至。「東方報業民意調查」結果顯示，大部分受訪者批評政治風波禍及民生，形容香港如無政府狀態，黑幫乘虛而入，輸入南亞兵團趁火打劫，憂慮社會秩序失控，示威、毒禍、假難民等惡瘤齊發，加速香港淪亡。反修例政治風波爆發連串示威衝突，警方抗暴疲於奔命。偷運南亞人蛇一直由黑幫操控，近期人蛇密密搶灘，主要原因是受本港修例風波影響，有人覷準機會在南亞多國散布謠言，慫恿南亞人趕來香港「搵食」甚至伺機犯案。自六月發生反修例暴動以及連串示威後，警方至今已搗破五宗南亞偷渡案，包括六月廿六日，八名巴裔人蛇及兩名內地「蛇頭」在流浮山被水警拘捕；本月四日有七名巴裔人蛇在西貢西灣村搶灘被截；本月十二日，警方在西貢清水灣二灘截獲三名南亞裔人蛇；警方於十六日在西貢截獲六名孟加拉及岡比亞人蛇，不足廿四小時又在油塘截獲五名印度籍及巴基斯坦籍人蛇。警方相信人蛇由內地來港伺機犯案，一旦被捕便提出免遣返聲請留港。惡勢力乘虛而入 毀社會秩序「東方報業民意調查」於上周四至六以手機東網港澳APP及街頭問卷形式，成功訪問三百八十二名十八歲或以上市民，結果顯示，對於有人蛇集團趁亂散布謠言， 近月密密偷運南亞人蛇來港，三成三受訪者坦言，擔心黑幫輸入生力軍作惡；三成一形容南亞兵團趁火打劫；兩成三憂南亞人蛇偷渡潮大爆發。暴力衝突不斷警方疲於奔命，面對大批南亞人蛇湧港「搵食」伺機犯案，四成九受訪者擔心社會秩序失控；兩成二憂惡勢力乘虛而入；兩成恐治安呈現漏洞。政府養治安毒瘤 6年燒58億港府擬修訂入境條例應對假難民問題，但近日政治風波癱瘓立法會連累相關草案停滯，六成四受訪者直斥政治風波禍及民生；一成五轟無法堵塞法例漏洞；一成四擔心假難民問題再度惡化。香港仍有逾萬名假難民，政府處理免遣返聲請及相關工作六年燒逾五十八億公帑，五成五受訪者直斥浪費公帑養治安毒瘤；三成四認為，應盡快設禁閉營減低誘因。假難民、南亞兵團犯案有恃無恐，違法示威衝擊不斷，四成受訪者歸咎是政府姑息縱容所致；三成五形容法治淪亡，無法無天；一成七質疑律政司淪為黑惡保護傘。如無政府狀態 港陷入死胡同香港暴力衝擊遍地開花，黑惡勢力和治安毒瘤乘勢發難，三成七受訪者形容，香港如無政府狀態，一片混亂；三成更形容惡瘤齊發，香港加速淪亡；兩成二無奈指，香港陷入死胡同，不知道何去何從。綜觀情況，大部分受訪者批評香港暴力衝突不絕，警方抗暴疲於奔命，恐現治安漏洞，黑惡勢力更加猖狂，政府積弱多時，面對惡瘤齊發，整個社會恐陷入一片混亂。,港聞,A08,Pro-Beijing,1118,23,7,1,0
